STUDY_ID,TITLE,BIOME_MAP,CLIMATE,REALM,TAXA,Duration,CONTACT_1,CONTACT_2,wkt
10,Windstorm disturbance without patch dynamics twelve years of change in a Minnesota forest,Temperate broadleaf and mixed forests,Temperate,Terrestrial,Plants,13,Sara Webb,Sara Scanga,POINT (-8190232 5316708)
18,Mapped quadrats in sagebrush steppe long-term data for analyzing demographic rates and plant to plant interactions,Deserts and xeric shrublands,Temperate,Terrestrial,Plants,51,Luke Zachmann,NA,POINT (-9829906 4978417)
33,Long-term phytoplankton community dynamics in the Western English Channel,Temperate shelf and seas ecoregions,Temperate,Marine,Plants,18,Claire Widdicombe,NA,POINT (-357205 5627245)
39,Bird community dynamics in a temperate deciduous forest Long-term trends at Hubbard Brook,Temperate broadleaf and mixed forests,Temperate,Terrestrial,Birds,46,Richard Holmes,Tom Sherry,POINT (-6291984 4931878)
41,Time and space and the variation of species,Temperate broadleaf and mixed forests,Temperate,Terrestrial,Birds,18,Author now deceased,Queries at Ecology,POINT (-7382371 4440303)
46,Skokholm Bird Observatory,Temperate broadleaf and mixed forests,Temperate,Terrestrial,Birds,52,Mark Williamson,NA,POINT (-443065.4 5783494)
51,Fluctuations and long-term in the relative densities of tetraonid populations in Finland. 1964-77,Boreal forests/taiga,Temperate,Terrestrial,Birds,14,Harto Linden,Global Population Dynamics Database,POINT (2011229 6850212)
52,A transect survey of small land carnivore and red fox populations on a subarctic fell in Finnish forest Lapland over 13 winters,Boreal forests/taiga,Polar,Terrestrial,Mammals,13,Erkki Pulliainen,Global Population Dynamics Database,POINT (2194491 7424136)
53,An 11-year study of small mammal populations at Mont St. Hilaire. Quebec,Temperate broadleaf and mixed forests,Temperate,Terrestrial,Mammals,11,Peter Grant,Global Population Dynamics Database,POINT (-6363438 5114812)
54,El Verde Grid invertebrate data (Big Grid Snail Captures 1991-2007),Tropical and subtropical dry broadleaf forests,Tropical,Terrestrial,Invertebrates,33,Christopher Bloch,Michael Willig,POINT (-6243899 2037623)
58,Avian populations long-term monitoring dataset. San Juan. Puerto Rico Luquillo Long Term Ecological Research Site Database Grid points bird counts DBAS 23,Tropical and subtropical dry broadleaf forests,Tropical,Terrestrial,Birds,18,Robert Waide,E Melendez,POINT (-6236973 2040243)
59,Long-term monitoring and experimental manipulation of a Chihuahuan Desert ecosystem near Portal. Arizona. USA,Deserts and xeric shrublands,Temperate,Terrestrial,Mammals,26,Morgan Ernest,Thomas Valone,POINT (-9582909 3407604)
60,Forest Census Plot on Barro Colorado Island,Tropical and subtropical moist broadleaf forests,Tropical,Terrestrial,Plants,34,Stephen Hubbell,Richard Condit,POINT (-7700565 1025413)
63,Monitoring butterfly numbersThe development of dragonfly communities and the consequences of territorial behaviour A 27-year study on small ponds at Woodwalton Fen. Cambridgeshire. United Kingdom,Small lake ecosystems,Temperate,Terrestrial,Invertebrates,27,Great Fen,Global Population Dynamics Database,POINT (-15122.31 5861205)
87,Phytoplankton in the Oosterschelde before. during and after the storm-surge barrier (1982-1990),Temperate shelf and seas ecoregions,Temperate,Marine,Plants,9,Peter Herman,NA,POINT (328765.3 5767494)
150,Admiralty Bay Benthos Diversity Data Base (ABBED).,Temperate shelf and seas ecoregions,Temperate,Marine,Invertebrates,8,Jacek Sicinski,Bruno Danis,POINT (-4559525 -6873460)
189,St. John. USVI Fish Assessment and Monitoring Data (2002 - Present) (NOAA-CCMA),Tropical seas,Tropical,Marine,Fish,10,Kimberley Robertson,NA,POINT (-6170756 2053600)
190,St. Croix. USVI Fish Assessment and Monitoring Data (2002 - Present) (NOAA-CCMA),Tropical seas,Tropical,Marine,Fish,10,Kimberley Robertson,NA,POINT (-6162849 1991543)
194,Spatial and temporal distribution and abundance of moths in the Andrews Experimental Forest. 1994 to 2004,Temperate coniferous forest,Temperate,Terrestrial,Invertebrates,11,Julia Jones,Jeffrey Miller,POINT (-10694568 4968892)
196,SOTEAG Rocky Shore Survey (Sullom Voe),Temperate shelf and seas ecoregions,Temperate,Marine,Invertebrates,37,Rebecca Kinnear,Jon Moore,POINT (-104511.3 6702548)
201,Pasoh Forest Dynamics Plot. Malaysia - Smithsonian Tropical Research Institute,Tropical and subtropical moist broadleaf forests,Tropical,Terrestrial,Plants,14,Christine Fletcher,Abd Rahman Kassim,POINT (9901626 333993.3)
202,Mudumalai Forest Dynamics Plot. India - Smithsonian Tropical Research Institute,Tropical and subtropical moist broadleaf forests,Tropical,Terrestrial,Plants,13,R Sukuman,Sandeep Pulla,POINT (7363589 1299854)
224,Experiment 133 - Effect of Burning Patterns on Vegetation in the Fish Lake Burn Compartments - Shrub Survey,Temperate broadleaf and mixed forests,Temperate,Terrestrial,Plants,11,Peter Reich,NA,POINT (-8111337 5096715)
225,Point count bird censusing long-term monitoring of bird distrubution and diversity in central Arizona-Phoenix period 2000 to 2011,Deserts and xeric shrublands,Temperate,Terrestrial,Birds,12,Nancy Grimm,NA,POINT (-10257897 3758020)
226,Transect bird survey with data synthesis from multiple transects in the central Arizona-Phoenix area period 1998 to 2000,Deserts and xeric shrublands,Temperate,Terrestrial,Birds,3,Nancy Grimm,NA,POINT (-10257897 3758020)
230,Macrophyte count data collected from Northeast Shark Slough Everglades National Park (FCE) from September 2006 to Present,Flooded grasslands and savannas,Temperate,Marine,Plants,3,Evelyn?Gaiser,Evelyn Gaiser,POINT (-7560416 2882940)
231,"Consumer Stocks: Fish, Vegetation, and other Non-physical Data from Everglades National Park (FCE LTER), South Florida, USA from February 2000 to April 2005",Flooded grasslands and savannas,Temperate,Freshwater,Multiple,6,Joel Trexler,Florida Coastal Everglades LTER Program,POINT (-7584144 2844977)
233,HF044. Land Use on the Southern New England and New York Coasts 1600-2001,Temperate broadleaf and mixed forests,Temperate,Terrestrial,Plants,3,David Foster,NA,POINT (-6373195 4778588)
234,"Forest Inventory of a Northern Hardwood Forest: Watershed 6, Hubbard Brook Experimental Forest (Trees &gt;=10cm dbh, 1977-2017)",Temperate broadleaf and mixed forests,Temperate,Terrestrial,Plants,41,"Information Manager, Hubbard Brook LTER",NA,POINT (-6289709 4936696)
235,Forest Inventory of a Northern Hardwood Forest Watershed 5,Temperate broadleaf and mixed forests,Temperate,Terrestrial,Plants,20,Information Manager at Hubbard Brook LTER,NA,POINT (-6289349 4936651)
236,Fish population on selected watersheds at Konza Prairie - CFP012 - Konza fish population,Small river ecosystems,Temperate,Freshwater,Fish,12,Keith B Gido,NA,POINT (-8657557 4394726)
237,Madison Wisconsin Lakes Zooplankton 1976 - 1994 - old net,Small lake ecosystems,Temperate,Freshwater,Invertebrates,19,Emily Stanley,NA,POINT (-7867263 4833655)
238,North Temperate Lakes LTER Zooplankton - Madison Lakes Area 1997 - current,Small lake ecosystems,Temperate,Freshwater,Invertebrates,20,Emily Stanley,NA,POINT (-7871812 4838815)
239,Pinon Juniper Net Primary Production Quadrat Data from the Sevilleta National Wildlife Refuge New Mexico 1999-2001,Deserts and xeric shrublands,Temperate,Terrestrial,Plants,3,Douglas I. Moore,NA,POINT (-9763170 3861678)
240,Pinon-Juniper (Core Site) Quadrat Data for the Net Primary Production Study at the Sevilleta National Wildlife Refuge New Mexico (2003-present ),Deserts and xeric shrublands,Temperate,Terrestrial,Plants,13,Sevilleta LTER Information Manager,NA,POINT (-9763170 3861678)
241,Sherman Forest Dynamics Plot Panama,Tropical and subtropical moist broadleaf forests,Tropical,Terrestrial,Plants,14,Richard Condit,NA,POINT (-7709593 1049128)
242,Lac Croche understory vegetation data set (1998 to 2006),Temperate broadleaf and mixed forests,Temperate,Terrestrial,Plants,9,Alain Paquette,NA,POINT (-6420459 5162134)
243,Long-term N-fertilized vegetation plots on Hog Island Virginia Coastal Barrier Islands 1992 to 2014,Temperate coniferous forest,Temperate,Terrestrial,Plants,23,Frank Day,NA,POINT (-6830835 4210019)
246,Long-term monitoring dataset of fish assemblages impinged at nuclear power plants in northern Taiwan,Temperate shelf and seas ecoregions,Temperate,Marine,Fish,15,Kwang-Tsao Shao,NA,POINT (11421862 2834744)
247,Zooplankton survey of Oneida Lake New York 1964 to present,Small lake ecosystems,Temperate,Freshwater,Invertebrates,46,Lars Rudstam,Kristen Holeck,POINT (-6681025 4852705)
248,Evidence for long-term shift in plant community composition under decadal experimental warming,"Temperate grasslands, savannas and shrublands",Temperate,Terrestrial,Plants,13,Zheng Shi,NA,POINT (-8962726 4923377)
249,Resource specialists lead local insect community turnover associated with temperature - analysis of an 18-year full-seasonal record of moths and beetles,Temperate broadleaf and mixed forests,Temperate,Terrestrial,Invertebrates,16,Peter Jorgensen,Philip Thomsen,POINT (1027183 6209405)
253,North Temperate Lakes LTER Zooplankton - Trout Lake Area 1982 - current,Small lake ecosystems,Temperate,Freshwater,Invertebrates,40,NTL LTER Information Manager,NTL LTER Lead PI,POINT (-7777939 5166673)
254,North Temperate Lakes LTER: Phytoplankton - Madison Lakes Area 1995 - current,Small lake ecosystems,Temperate,Freshwater,Plants,26,John J. Magnuson,NTL LTER,POINT (-7876500 4845926)
255,Multi-decade. spatially explicit population studies of canopy dynamics in Michigan old-growth forests,Temperate broadleaf and mixed forests,Temperate,Terrestrial,Plants,15,Kerry D. Woods,NA,POINT (-7544776 5203242)
257,Madison Wisconsin Lakes Zooplankton 1976 - 1994 - new net,Small lake ecosystems,Temperate,Freshwater,Invertebrates,4,Emily Stanley,NA,POINT (-7870222 4839872)
270,Experimental evidence of reduced diversity of seedlings due to climate modification in a Mediterranean-type community.,"Mediterranean forests, woodlands and scrubs",Temperate,Terrestrial,Plants,4,Francisco Lloret,NA,POINT (168704.5 4641521)
271,"Santa Barbara Coastal LTER Reef: Kelp Forest Community Dynamics: Abundance and size of Giant Kelp (Macrocystis Pyrifera), ongoing since 2000",Temperate shelf and seas ecoregions,Temperate,Marine,Fish,15,Dan Reed,NA,POINT (-10951967 3856682)
272,Santa Barbara Coastal LTER Reef: Kelp Forest Community Dynamics: Fish abundance,Temperate shelf and seas ecoregions,Temperate,Marine,Invertebrates,15,Dan Reed,NA,POINT (-10952057 3856670)
273,Santa Barbara Coastal LTER Reef: Kelp Forest Community Dynamics: Invertebrate and algal density,Temperate shelf and seas ecoregions,Temperate,Marine,Invertebrates,15,Dan Reed,NA,POINT (-10952057 3856670)
274,"Santa Barbara Coastal LTER Reef: Kelp Forest Community Dynamics: Cover of sessile organisms, Uniform Point Contact",Temperate shelf and seas ecoregions,Temperate,Marine,Multiple,15,Dan Reed,NA,POINT (-10951967 3856682)
275,Response of an urban remnant reptile community to summer wildfire,"Mediterranean forests, woodlands and scrubs",Temperate,Terrestrial,Reptiles,6,Dr Rob A. Davis,Dr Tim S. Doherty,POINT (10668443 -3593144)
276,Eutrophication and Dreissena Invasion as Drivers of Biodiversity A Century of Change in the Mollusc Community of Oneida Lake,Small lake ecosystems,Temperate,Freshwater,Invertebrates,96,Vadim Karatayev,NA,POINT (-6693841 4853081)
294,Tam Dao Butterfly communities,Tropical and subtropical moist broadleaf forests,Tropical,Terrestrial,Invertebrates,11,Timothy C Bonebrake,Lie Van Vu,POINT (9963727 2365851)
298,Long-term mapped quadrats from Kansas prairie demographic information for herbaceaous plants,"Temperate grasslands, savannas and shrublands",Temperate,Terrestrial,Plants,70,Peter B Adler,NA,POINT (-8914413 4361877)
299,Elba Island Butterflies,"Mediterranean forests, woodlands and scrubs",Temperate,Terrestrial,Invertebrates,101,Leonardo Dapporto,NA,POINT (908279.5 4805287)
300,Insect Populations via Sticky Traps at KBS-LTER (Kellogg Biological Station. MI),Temperate broadleaf and mixed forests,Temperate,Terrestrial,Invertebrates,25,Doug Landis,Stuart Gage,POINT (-7542275 4765105)
301,Konza Prarie grasshoppers -  CGR022,"Temperate grasslands, savannas and shrublands",Temperate,Terrestrial,Invertebrates,37,Ellen Welti,Anthony Joern,POINT (-8660170 4393372)
302,Patterns and processes affecting the dynamics and structure of seasonally semideciduous forests in SE Brazil(Padroes e processos que influenciam a dinamica e a estrutura das Florestas Estacionais Semideciduais SE Brasil),Tropical and subtropical moist broadleaf forests,Tropical,Terrestrial,Plants,10,Tiago Egydio Barreto,"Ricardo Rodrigues, Renato Augusto Ferreira de Lima and Thiago Almeida Bueno",POINT (-4696927 -2511788)
303,The influence of environmental variables on tree species component dynamics in a montane forest fragment in Lages SC Brazil Influencia de variaveis ambientais na dinamica do componente arboreo em um fragmento de Floresta Ombrofila Mista em Lages SC,Tropical and subtropical moist broadleaf forests,Temperate/Tropical,Terrestrial,Plants,9,Pedro Higuchi,Ana Carolina da Silva,POINT (-4681239 -3129742)
305,Population estimates of Appalachian salamanders. Coweeta LTER,Temperate broadleaf and mixed forests,Temperate,Terrestrial,Amphibians,15,R Haven Wiley,NA,POINT (-7609400 3934876)
306,Edwin S. George Reserve Turtles. The Global Population Dynamics Database Version 2,Small lake ecosystems,Temperate,Freshwater,Reptiles,18,Barry Brook,NA,POINT (-7413629 4770464)
307,Kellogg LTER seed bank,Temperate broadleaf and mixed forests,Temperate,Terrestrial,Plants,10,Sven Bohm,Kay Gross,POINT (-7542275 4765105)
308,Long Term Mammal Data from Powdermill Biological Station 1979-1999,Temperate broadleaf and mixed forests,Temperate,Terrestrial,Mammals,21,Joseph F Merritt,NA,POINT (-7073454 4515363)
311,Seasonal summary of numbers of small mammals on 14 LTER traplines in prairie habitats at Konza Prairie,"Temperate grasslands, savannas and shrublands",Temperate,Terrestrial,Mammals,33,Donald W. Kaufman,NA,POINT (-8660135 4393631)
312,Stability in a Multi-Species Assemblage of Large Herbivores in East Africa,"Tropical and subtropical grasslands, savannas and shrublands",Tropical,Terrestrial,Mammals,26,Herbert Henri Theodore Prins,NA,POINT (3459269 392016.9)
313,Successional Dynamics on a Resampled Chronosequence Core Old Field Grasshopper Sampling,Temperate broadleaf and mixed forests,Temperate,Terrestrial,Invertebrates,18,Knops Johannes,Tilman David,POINT (-8111337 5096715)
314,Successional Dynamics on a Resampled Chronosequence Small mammal abundance,Temperate broadleaf and mixed forests,Temperate,Terrestrial,Mammals,3,Knops Johannes,Tilman David,POINT (-8111337 5096715)
315,Jornada Grasshopper Data,Deserts and xeric shrublands,Temperate,Terrestrial,Invertebrates,3,John Anderson,David Lightfoor,POINT (-9809518 3666714)
316,Lizard pitfall trap data (LTER-II LTER-III),Deserts and xeric shrublands,Temperate,Terrestrial,Reptiles,18,John Anderson,David Lightfoot,POINT (-9809518 3666714)
317,Mangrove Forest Growth from the Shark River Slough Everglades National Park (FCE) South Florida from January 1995 to Present,Flooded grasslands and savannas,Temperate,Terrestrial,Plants,11,Robert ATwilley,Victor Rivera-Monroy,POINT (-7591493 2845083)
319,Effects of rangeland management on community dynamics of herpetofauna to the tallgrass prairie,"Temperate grasslands, savannas and shrublands",Temperate,Terrestrial,Multiple,15,Dustin J. Wilgers,NA,POINT (-8737928 4187933)
321,Small Mammal Exclosure Study. Jornada LTER.  SMES rodent trapping data,Deserts and xeric shrublands,Temperate,Terrestrial,Mammals,13,Robert Schooley,NA,POINT (-9818406 3658860)
322,Forest destructuring as revealed by the temporal dynamics of fundamental species - Case study of Santa Genebra Forest in Brazil,Tropical and subtropical moist broadleaf forests,Tropical,Terrestrial,Plants,22,Fabiano Turini Farah,"Ricardo Rodrigues, Renato Augusto Ferreira de Lima and Thiago Almeida Bueno",POINT (-4449142 -2562037)
323,The Response of Anolis Lizards to Hurricane-Induced Habitat Changes in a Puerto Rican Rain Forest.,Tropical and subtropical moist broadleaf forests,Tropical,Terrestrial,Reptiles,4,Douglas Reagan,NA,POINT (-6269166 2054595)
324,Temporal evaluation of natural regeneration in a semi-deciduous forest in Pirenopolis. Goias. Brazil,"Tropical and subtropical grasslands, savannas and shrublands",Tropical,Terrestrial,Plants,5,Fabio Venturoli,NA,POINT (-4688244 -1774110)
325,Temporal evaluation of natural regeneration in a semi-deciduous forest in Pirenopolis. Goias. Brazil,"Tropical and subtropical grasslands, savannas and shrublands",Tropical,Terrestrial,Plants,5,Fabio Venturoli,NA,POINT (-4688244 -1774110)
326,Temporal evaluation of natural regeneration in a semi-deciduous forest in Pirenopolis. Goias. Brazil,"Tropical and subtropical grasslands, savannas and shrublands",Tropical,Terrestrial,Plants,5,Fabio Venturoli,NA,POINT (-4688244 -1774110)
327,Fray Jorge Small Mammals 1989-2005,"Mediterranean forests, woodlands and scrubs",Temperate,Terrestrial,Mammals,17,Douglas A. Kelt,NA,POINT (-6632798 -3438897)
328,The Rainbow Bay Long-term Study,Small river ecosystems,Temperate,Freshwater,Amphibians,30,David Scott,NA,POINT (-7510965 3626124)
329,Twenty years tree demography in an undisturbed Dipterocarp permanent sample plot at Uppangala Western Ghats of India,Tropical and subtropical moist broadleaf forests,Tropical,Terrestrial,Plants,21,N. Ayyappan,NA,POINT (7272051 1405183)
332,Stream Fish Assemblage stability in a southern Appalachian stream (Coweeta Hydro Lab 1984 - 1995),Small river ecosystems,Temperate,Freshwater,Fish,12,Gary D Grossman,NA,POINT (-7601538 3941507)
333,Weekly record of bird species observed on Konza Prairie,"Temperate grasslands, savannas and shrublands",Temperate,Terrestrial,Birds,29,JMB,J Briggs,POINT (-8660135 4393631)
334,"Above ground plant biomass in a mesic acidic tussock tundra experimental site from 1982 to 2015 Arctic LTER, Toolik Lake, Alaska",Tundra,Polar,Terrestrial,Plants,19,Gaius Shaver,Arctic LTER Data Manager,POINT (-11039687 7508410)
335,Stochasticity in structural and functional characteristics of an Indiana stream fish assemblage  a test of community theory,Small river ecosystems,Temperate,Freshwater,Fish,13,Gary D Grossman,NA,POINT (-7820983 4447267)
336,Long term monitoring and experimental manipulation of a Chihuahuan Desert ecosystem near Portal Arizona,Deserts and xeric shrublands,Temperate,Terrestrial,Plants,14,Morgan Ernest,Tom Valone,POINT (-10047375 3589913)
337,Mountain Birdwatch,Temperate broadleaf and mixed forests,Temperate,Terrestrial,Birds,11,John D. Lloyd,Kent P. McFarland,POINT (-6319610 4969556)
338,Dynamics and Organization of a Rocky Intertidal Fish Assemblage,Temperate shelf and seas ecoregions,Temperate,Marine,Fish,3,Gary D Grossman,NA,POINT (-11078813 4272145)
339,Species trends turnover and composition of a woodland bird community in southern Sweden during a period of 57 years.,Temperate broadleaf and mixed forests,Temperate,Terrestrial,Birds,57,Soren Svensson,NA,POINT (1090412 6210893)
340,"Small Mammal Exclosure Study (SMES) Vegetation Data from the Chihuahuan Desert Grassland and Shrubland at the Sevilleta National Wildlife Refuge, New Mexico (1995-2009)",Deserts and xeric shrublands,Tropical,Terrestrial,Plants,15,David Lightfoot,NA,POINT (-9759987 3857689)
342,Brazil Dataset 2,"Tropical and subtropical grasslands, savannas and shrublands",Tropical,Terrestrial,Plants,19,Giselda Durigan,NA,POINT (-4772665 -2548077)
343,Brazil Dataset 3,Tropical and subtropical moist broadleaf forests,Tropical,Terrestrial,Plants,18,Giselda Durigan,NA,POINT (-4723015 -2471723)
344,Brazil Dataset 4,"Tropical and subtropical grasslands, savannas and shrublands",Tropical,Terrestrial,Plants,13,Giselda Durigan,NA,POINT (-4759748 -2536371)
345,Brazil Dataset 5,"Tropical and subtropical grasslands, savannas and shrublands",Tropical,Terrestrial,Plants,13,Giselda Durigan,NA,POINT (-4762120 -2537689)
346,Monitoring experiences at the Atlantic rainforest biome using permanent plots.,"Tropical and subtropical grasslands, savannas and shrublands",Tropical,Terrestrial,Plants,10,Carolina Mathias Moreira,"Ana Paula Savassi-Coutinho Giselda Durigan Vincius Castro Souza Natlia Macedo Ivanauskas Ricardo Ribeiro Rodrigues, Renato Augusto Ferreira de Lima and Thiago Almeida Bueno",POINT (-4760709 -2535897)
347,Zooplankton community of the Vitoria Bay estuarine system (southeastern Brazil). Characterization during a three-year study,Tropical seas,Tropical,Marine,Invertebrates,3,Jose Mauro Sterza,Luiz Loureiro Fernandes,POINT (-3828802 -2276402)
349,St. M polychaete species time-series,Temperate shelf and seas ecoregions,Temperate,Marine,Invertebrates,21,Claire Laguionie-Marchais,Henry Ruhl,POINT (-11214782 3925643)
350,Megafauna PAP time series,Temperate shelf and seas ecoregions,Temperate,Marine,Invertebrates,23,Claire Laguionie-Marchais,Henry Ruhl,POINT (-1407949 5491508)
351,Megafauna Sta M time series,Temperate shelf and seas ecoregions,Temperate,Marine,Invertebrates,16,Claire Laguionie-Marchais,Henry Ruhl,POINT (-11215937 3916110)
352,Flooded forest plot sampling in Peru,Tropical and subtropical moist broadleaf forests,Tropical,Terrestrial,Plants,4,Randall W. Myster,NA,POINT (-7259975 -224001.2)
353,La Planada Forest Dynamics Plots,Tropical and subtropical moist broadleaf forests,Tropical,Terrestrial,Plants,7,Natalia Norden Medina,NA,POINT (-7550674 129448.7)
355,Plant Species Composition on Selected Watersheds at Konza Prairie,"Temperate grasslands, savannas and shrublands",Temperate,Terrestrial,Plants,33,David C. Hartnett,Scott L. Collins,POINT (-8660135 4393631)
357,Small Mammal Trapping Webs on the Central Plains Experimental Range,"Temperate grasslands, savannas and shrublands",Temperate,Terrestrial,Mammals,13,Paul Stapp,NA,POINT (-9321594 4588925)
358,Neotropical Migratory Bird Communities in a Developing Pine Plantation,Temperate coniferous forest,Temperate,Terrestrial,Birds,16,H Williamson,NA,POINT (-8743778 3549814)
359,SBC LTER Reef Kelp Forest Community Dynamics Fish abundance,Temperate shelf and seas ecoregions,Temperate,Marine,Fish,13,Santa Barbara Coastal LTER,Daniel C Reed,POINT (-10951769 3857049)
360,Bialowieza National Park bird assemblage,Temperate broadleaf and mixed forests,Temperate,Terrestrial,Birds,40,Tomasz Wesolowski,NA,POINT (2024436 5892734)
361,A long-term bird population study in an Appalachian spruce forest,Temperate broadleaf and mixed forests,Temperate,Terrestrial,Birds,22,JSTOR,NA,POINT (-7172688 4340575)
362,Plant and small-mammal responses to large-herbivore exclusion in an African savanna,"Tropical and subtropical grasslands, savannas and shrublands",Tropical,Terrestrial,Mammals,4,Tyler R. Kartzinel,NA,POINT (3571726 43593.91)
363,The 37-year dynamics of a subalpine bird community with special emphasis on the influence of environmental temperature and Epirrita autumnata cycles.,Tundra,Temperate,Terrestrial,Birds,37,Anders Enemar,NA,POINT (1232782 7251443)
364,Long-term reductions in anthropogenic nutrients link to improvements in Chesapeake Bay habitat,Large river ecosystems,Temperate,Freshwater,Plants,18,Nancy Rybicki,Henry Ruhl,POINT (-6915731 4373198)
365,Hahei marine dataset (1997-2002),Temperate shelf and seas ecoregions,Temperate,Marine,Fish,6,Trevor Willis,NA,POINT (15929793 -4188661)
366,Small Mammal Exclosure Study (SMES),Deserts and xeric shrublands,Temperate,Terrestrial,Mammals,25,David Lightfoot,NA,POINT (-9763170 3861678)
368,Monitoring site 1000 Land waters research- Lakes benthic animal research,Small lake ecosystems,Temperate,Freshwater,Invertebrates,2,Ecosystem monitoring department and maintenance department. Nature Conservation Bureau Ministry of the Environment Biodiversity Center,NPO Japan Wetlands International,POINT (12385094 3977528)
369,Monitoring site 1000 Alpine research - Surface wandering beetles,Temperate broadleaf and mixed forests,Temperate,Terrestrial,Invertebrates,6,General Foundation Natural Environment Research Center monitoring site 1000 alpine zone personnel,Nature Conservation Bureau Ministry of the Environment Biodiversity Center Contact: ecosystem monitoring Department,POINT (12409982 4063960)
378,Calafuria Mid-shore Intertidal Dataset (1991-2014),Temperate shelf and seas ecoregions,Temperate,Marine,Invertebrates,16,Lisandro Benedetti Cecchi,NA,POINT (908366 4882993)
379,Calafuria Low-shore Intertidal Dataset (1991-2014),Temperate shelf and seas ecoregions,Temperate,Marine,Invertebrates,24,Lisandro Benedetti Cecchi,NA,POINT (908366 4882993)
380,Monitoring butterfly numbers,Temperate broadleaf and mixed forests,Temperate,Terrestrial,Invertebrates,10,GPDD,NA,POINT (4658.999 5691723)
381,Long-term sampling of a herpetofaunal assemblage on an isolated urban bushland,"Mediterranean forests, woodlands and scrubs",Temperate,Terrestrial,Multiple,7,R A How,NA,POINT (10663505 -3589283)
382,Small Mammals and Vegetation Changes After Fire in a Mixed Conifer-Hardwood Forest,Temperate broadleaf and mixed forests,Temperate,Terrestrial,Mammals,13,Contact at GPDD,NA,POINT (-7888244 5364161)
383,Boubin,Temperate broadleaf and mixed forests,Temperate,Terrestrial,Plants,39,Tomas Vrska,Kamil Kral,POINT (1178640 5489070)
384,Cahnov-Soutok,Temperate broadleaf and mixed forests,Temperate,Terrestrial,Plants,34,Tomas Vrska,Kamil Kral,POINT (1448459 5453940)
385,Milesice,Temperate broadleaf and mixed forests,Temperate,Terrestrial,Plants,40,Tomas Vrska,Kamil Kral,POINT (1180956 5489843)
386,Mionsi-V,Temperate coniferous forest,Temperate,Terrestrial,Plants,16,Tomas Vrska,Kamil Kral,POINT (1587326 5549844)
387,Mionsi-R,Temperate coniferous forest,Temperate,Terrestrial,Plants,52,Tomas Vrska,Kamil Kral,POINT (1587389 5549995)
388,Mionsi-C,Temperate coniferous forest,Temperate,Terrestrial,Plants,58,Tomas Vrska,Kamil Kral,POINT (1586839 5549817)
