STUDY_ID,TITLE,BIOME_MAP,CLIMATE,REALM,TAXA,Duration,CONTACT_1,CONTACT_2,wkt
623,LTER INBO Lower Seascheldt Invertebrates 1999-2005,Small river ecosystems,Temperate,Freshwater,Invertebrates,8,Gunther Van Ryckegem,NA,POINT (363282.4 5738772)
624,LTER INBO Lower Seascheldt Waterbirds 1991-2017,Small river ecosystems,Temperate,Freshwater,Birds,27,Gunther Van Ryckegem,NA,POINT (360669.4 5740674)
625,LTER Lake Muggelsee Germany Phytoplankton,Small lake ecosystems,Temperate,Freshwater,Invertebrates,21,Rita Adrian,NA,POINT (1140751 5863122)
626,LTER Lake Muggelsee Germany Zooplankton,Small lake ecosystems,Temperate,Freshwater,Invertebrates,21,Rita Adrian,0,POINT (1140751 5863122)
627,"LTER Norholm Hede, Denmark Plants","Temperate grasslands, savannas and shrublands",Temperate,Terrestrial,Plants,91,Inger Kappel Schmidt,NA,POINT (703875.5 6207044)
628,LTER Rhine-Main Observatory Aquatic Invertebrates,Small river ecosystems,Temperate,Freshwater,Invertebrates,16,Peter Haase,NA,POINT (786858 5614075)
631,"NIES Fish monitoring data in Lake Kasumigaura, 2005-2021",Large lake ecosystems,Temperate,Freshwater,Fish,17,Shin-ichiro S. Matsuzaki,Kumiko Totsu,POINT (12743526 4045897)
632,"Point-count bird censusing: long-term monitoring of bird abundance and diversity along the Salt River in the greater Phoenix metropolitan area, ongoing since 2013",Small river ecosystems,Temperate,Terrestrial,Birds,6,Heather Bateman,Paige Warren,POINT (-10267898 3761383)
636,"North Temperate Lakes LTER Core Data Phytoplankton, Paul Lake, 1984-1995",Small lake ecosystems,Temperate,Freshwater,Invertebrates,12,Stephen Carpenter,Mike Pace,POINT (-7754783 5190533)
637,"North Temperate Lakes LTER Core Data Phytoplankton, Paul Lake, 2013-2015",Small lake ecosystems,Temperate,Freshwater,Invertebrates,3,Stephen Carpenter,Mike Pace,POINT (-7754783 5190533)
638,Cascade Project at North Temperate Lakes LTER Core Data Zooplankton 1984 - 2016,Small lake ecosystems,Temperate,Freshwater,Invertebrates,33,Stephen Carpenter,Mike Pace,POINT (-7754783 5190533)
639,"Operation Wallacea marine site in Hoga, Indonesia - Wakatobi National Park",Tropical coral,Tropical,Marine,Fish,11,Dan Exton,NA,POINT (11963492 -611834.5)
641,Regional Watershed Monitoring Program Fish Community Data (2018-2021),Small river ecosystems,Temperate,Freshwater,Fish,4,Jan Moryk,NA,POINT (0 0)
642,"Regional Watershed Monitoring Program Benthic Macroinvertebrate Data, 2013-2021",Small lake ecosystems,Temperate,Freshwater,Invertebrates,8,Jessica Fang,Ryan Scott,POINT (-6972810 4923579)
643,Back into the past: Resurveying random plots to track community changes in Italian coastal dunes.,"Mediterranean forests, woodlands and scrubs",Temperate,Terrestrial,Plants,14,Marta Sperandii,NA,POINT (1098072 4678734)
644,TRCA Waterfront Fish Data 2000 - 2018,Large lake ecosystems,Temperate,Freshwater,Fish,19,general,Angela Wallace,POINT (-6959580 4908376)
646,Cross-Scale Interactions and the Distribution-Abundance Relationship,Temperate broadleaf and mixed forests,Temperate,Terrestrial,Amphibians,15,Earl Werner,NA,POINT (-7419551 4770161)
647,Heatwave restructures marine intertidal communities across a stress gradient,Temperate shelf and seas ecoregions,Temperate,Marine,Invertebrates,12,Matthew Whalen,NA,POINT (-10760734 5779035)
650,Bees and their floral visits in Sapporo in 1979 and 1989,"Temperate grasslands, savannas and shrublands",Temperate,Terrestrial,Invertebrates,11,Takeshi Matsumura,Hisatomo Taki,POINT (12444820 4839193)
651,"More coral, more fish? Contrasting snapshots from a remote Pacific atoll",Tropical coral,Tropical,Marine,Fish,29,Ricardo Beldade,NA,POINT (14238566 1670447)
655,"Quadrat-based monitoring of desert grassland vegetation at the Jornada Experimental Range, New Mexico, 1915â€“2016","Tropical and subtropical grasslands, savannas and shrublands",Temperate,Terrestrial,Plants,102,Erica Christensen,Jornada Data Manager,POINT (9810550 3666331)
656,Long-term zooplankton community records Lake Suwa (1996-2017),Large lake ecosystems,Temperate,Freshwater,Invertebrates,22,Masaki Sakamoto,Yuichi Miyabara,POINT (12534782 4051164)
657,"Flora at LTSER Zone Atelier Armorique - France, 1994-2017 [Data set]","Temperate grasslands, savannas and shrublands",Temperate,Terrestrial,Plants,24,Audrey Alignier,Yuichi Miyabara,POINT (130855.4 5447916)
658,"Herpethofauna from Aguas Santa Barbara, 2016-2020","Tropical and subtropical grasslands, savannas and shrublands",Tropical,Terrestrial,Multiple,5,Marcio Martins,"Filipe C. Serrano, Bruno F. Fiorillo",POINT (-4650620 -2559787)
659,Ainsdale Dune Slacks LTE,Flooded grasslands and savannas,Temperate,Terrestrial,Plants,37,Jonathan Millett,"Ciara Dwyer, Sally Edmonson",POINT (-254617.7 5986298)
660,Alcatrazes_monitoring_program,Tropical coral,Tropical,Marine,Fish,10,Juan Pablo Quimbayo,NA,POINT (-4303580 -2705830)
661,"Fishes inhabiting tidepools in the Tablado Beach, Amazonian Coastal Zone, during the Wet Season",Multiple,Tropical,Marine,Fish,4,Bruno Eleres Soares,Luciano Fogaca de Assis Montag,POINT (-4607494 -66107.71)
662,NA,"Tropical and subtropical grasslands, savannas and shrublands",Tropical,Terrestrial,Plants,2,Cassy Anne Rodrigues,Alessandra Fidelis,POINT (-4588777 -1533572)
663,Dynamic and diverse amphibian assemblages: Can we differentiate natural processes from human induced changes?,"Tropical and subtropical grasslands, savannas and shrublands",Tropical,Freshwater,Amphibians,19,Nathalia G. S. Lima,Paula C. Eterovick,POINT (-4144400 -2162255)
664,Coastal batoid surveys in the Levant,Temperate shelf and seas ecoregions,Temperate,Marine,Fish,7,Shahar Chaikin,NA,POINT (3206737 3643845)
665,Birds from Carlos Botelho Park,Tropical and subtropical moist broadleaf forests,Temperate/Tropical,Terrestrial,Birds,2,Alexsander Zamorano Antunes,NA,POINT (-4519080 -2713585)
666,Dung beetles from Santa Catarina Island,Tropical and subtropical moist broadleaf forests,Tropical,Terrestrial,Invertebrates,4,Malva Isabel Medina Hernandez,NA,POINT (-4527257 -3104504)
667,Fish assemblage distribution along free-flowing rivers entering a reservoir cascade,Large river ecosystems,Tropical,Freshwater,Fish,3,Paulo S.Pompeu,NA,POINT (-4211991 -2407719)
668,Insectivorous bats responses to land-use change and wildfires in Madeira island.,Tropical and subtropical moist broadleaf forests,Temperate/Tropical,Terrestrial,Mammals,6,Diogo F. Ferreira,Rym Nouioua,POINT (-1564586 3676777)
669,Phytoplankton Lake Bidighinzu,Small lake ecosystems,Temperate,Freshwater,Invertebrates,28,Bachisio Mario Padedda,Antonella Luglie,POINT (771646.2 4558442)
672,Operation Wallacea: Dominica birds,Tropical and subtropical moist broadleaf forests,Tropical,Terrestrial,Birds,3,Andrew Fairbairn,Thomas E. Martin,POINT (-5867668 1723467)
673,Operation Wallacea: Ecuador Amphibians,Tropical and subtropical moist broadleaf forests,Tropical,Terrestrial,Amphibians,3,Oliver Thomas,Thomas E. Martin,POINT (-7387519 -49349.08)
674,Operation Wallacea: Ecuador Reptiles,Tropical and subtropical moist broadleaf forests,Tropical,Terrestrial,Reptiles,3,Oliver Thomas,Thomas E. Martin,POINT (-7387519 -49349.08)
675,Operation Wallacea: Honduras Bats,Tropical and subtropical moist broadleaf forests,Tropical,Terrestrial,Mammals,14,Pamela Medina-van Berkum,Merlijn Jocque,POINT (-8448112 1739941)
676,Operation Wallacea: Honduras Birds,Tropical and subtropical moist broadleaf forests,Tropical,Terrestrial,Birds,14,Samuel E.I. Jones,Thomas Edward Martin,POINT (-6648297 4550234)
677,Operation Wallacea: Madagascan Amphibians,Tropical and subtropical dry broadleaf forests,Tropical,Terrestrial,Amphibians,7,Peter R. Long,Thomas E. Martin,POINT (4468930 -1735913)
678,Operation Wallacea: Madagascan Reptiles,Tropical and subtropical dry broadleaf forests,Tropical,Terrestrial,Reptiles,8,Peter R. Long,Joseph P. Wayman,POINT (4469543 -1735973)
679,Operation Wallacea: Mexico Amphibians,Tropical and subtropical moist broadleaf forests,Temperate/Tropical,Terrestrial,Amphibians,5,Kathy Slater,Jose Antonio L. Barao-Nobrega,POINT (-8530681 2060879)
680,Operation Wallacea: Mexico Butterflies,Tropical and subtropical moist broadleaf forests,Temperate/Tropical,Terrestrial,Invertebrates,2,Kathy Slater,Jose Antonio L. Barao-Nobrega,POINT (-8546550 2061698)
681,Operation Wallacea: Mexico Large Mammal Transects,Tropical and subtropical moist broadleaf forests,Temperate/Tropical,Terrestrial,Mammals,5,Kathy Slater,Jose Antonio L. Barao-Nobrega,POINT (-8530681 2060879)
682,Operation Wallacea: Romania Birds Point Count,Temperate broadleaf and mixed forests,Temperate,Terrestrial,Birds,6,Joseph J. Bailey,Thomas E. Martin,POINT (2152663 5173982)
683,Operation Wallacea: Romanian Butterflies,Temperate broadleaf and mixed forests,Temperate,Terrestrial,Invertebrates,6,Joseph J. Bailey,Thomas E. Martin,POINT (2153085 5173755)
684,Ornamental aquaculture in streams,Tropical and subtropical moist broadleaf forests,Tropical,Freshwater,Fish,13,Andre L. B. Magalhaes,"Jean Ricardo Simoes Vitule, Vanessa Daga",POINT (-4014694 -2351677)
685,Plant succession in reclaimed areas,"Temperate grasslands, savannas and shrublands",Temperate,Terrestrial,Plants,6,Petr Pysek,NA,POINT (4835260 1498632)
686,Reef fish in the Israeli Gulf of Aqaba,Tropical coral,Temperate/Tropical,Marine,Fish,8,Tal Gavriel,"Assaf Zvuloni, Jonathan Belmaker",POINT (3241292 3315783)
687,"Fishes inhabiting tidepools in the Tablado Beach, Amazonian Coastal Zone, during the Wet Season",Small lake ecosystems,Tropical,Freshwater,Fish,4,Bruno Eleres Soares,Erica Caramaschi,POINT (-5429472 -202494.4)
694,"SBC LTER: Beach: Time series of abundance of birds on selected beaches, ongoing since 2008",Temperate shelf and seas ecoregions,Temperate,Terrestrial,Birds,12,Jenifer E Dugan,NA,POINT (-10941398 3867310)
695,"Changes in the reef-coral community of Carysfort reef, Key Largo, Florida: 1974 to 1982",Temperate shelf and seas ecoregions,Temperate,Marine,Invertebrates,9,Phillip Dustan,NA,POINT (-7533749 2831627)
699,"Signals of resilience and change in tidepool fish communities on the Pacific coast of Vancouver Island, Canada",Temperate shelf and seas ecoregions,Temperate,Marine,Fish,51,Amanda E. Bates,John M. Green,POINT (-10692523 5462929)
703,"GOB Winter count of waterfowl, waders and seagulls in the Balearic Islands, 1998-2021",Small lake ecosystems,Temperate,Freshwater,Birds,24,Patrick Moussa,GOB-Mallorca,POINT (277104.8 4473886)
704,"Changes in breeding bird populations of an oak-wood on Bookham Common, Surrey, over twenty-seven years",Temperate broadleaf and mixed forests,Temperate,Terrestrial,Birds,27,Geoffrey Beven,NA,POINT (-32237.5 5740119)
705,Estudio de seguimiento de las reservas marinas de Cabo de Palos - Islas Hormigas y Cabo TiÃ±oso,Temperate shelf and seas ecoregions,Temperate,Marine,Fish,23,J.A. Garcia Charton,NA,POINT (-60434.19 4232856)
706,Long-term dynamics of Mediterranean frugivorous birds and fleshy fruits: a 12-year study,"Mediterranean forests, woodlands and scrubs",Temperate,Terrestrial,Birds,13,Carlos M. Herrera,NA,POINT (-258569.2 4265411)
707,Population trends of Laridae and Sternidae breeding in the Comacchio Laggon (NE Italy) between 1977 and 2001,Small lake ecosystems,Temperate,Marine,Birds,25,Pierandrea Brichetti,NA,POINT (1064355 5009411)
708,Terrestrial reptile counts in DoÃ±ana 2005-2021,"Temperate grasslands, savannas and shrublands",Temperate,Terrestrial,Reptiles,17,Ana C. Andreu,Rosa Arribas,POINT (-578787.8 4159844)
710,Cens Internacional d'ocells aquÃ tics i marins hivernants a Catalunya de gener de 2021,Large river delta ecosystems,Temperate,Marine,Birds,37,Ricard Gutierrez,NA,POINT (62323.51 4574526)
711,"The composition and dynamics of the passerine bird community in a subalpine birch forest, Swedish Lapland. A 20-year study",Boreal forests / taiga,Polar/Temperate,Terrestrial,Birds,20,NA,NA,POINT (1212562 7252121)
712,Long-term decline of a winter-resident bird community in Puerto Rico,Tropical and subtropical dry broadleaf forests,Tropical,Terrestrial,Birds,22,Jon Faaborg,NA,POINT (-6375712 2015500)
713,Temporal dynamics of marginal steppic vegetation over a 26-year period of substantial environmental change,"Temperate grasslands, savannas and shrublands",Temperate,Terrestrial,Plants,26,Silvia Matesanz,NA,POINT (994252.9 5771161)
714,Long-term dynamics of small-mammal populations in Ontario,Temperate broadleaf and mixed forests,Temperate,Terrestrial,Mammals,44,John M. Fryxell,NA,POINT (-6827176 5118067)
715,"Interspecific interactions, population variation, and environmental forcing in the context of the community","Temperate grasslands, savannas and shrublands",Temperate,Terrestrial,Birds,28,Elizabeth L. Porzig,NA,POINT (-11058115 4264289)
716,"Waterfowl counts in Pasvik nature reserve, 1996-2020",Large river ecosystems,Polar,Freshwater,Birds,25,Morten Gunther,Tor-Arne Bjorn,POINT (2148684 7557948)
717,Long-term woodpecker winter population dynamics in the Tatarstan Republic,Temperate broadleaf and mixed forests,Temperate,Terrestrial,Birds,25,Arthur Askeyev,Oleg Askeyev,POINT (4174511 6170199)
718,"Nest population size and potential production of geese and spectacled eiders on the Yukon-Kuskokwim Delta, Alaska, 1985-2013",Large river delta ecosystems,Polar,Marine,Birds,29,Julian B. Fischer,NA,POINT (-12984257 6767935)
719,"Nest population size and potential production of geese and spectacled eiders on the Yukon-Kuskokwim Delta, Alaska, 1985-2013",Large river delta ecosystems,Polar,Marine,Birds,26,Julian B. Fischer,NA,POINT (-12984257 6767935)
720,BioBasis Zackenberg - Breeding birds abundance,Polar ecoregions,Polar,Terrestrial,Birds,25,Niels Martin Schmidt,Jannik Hansen,POINT (-1435229 8049311)
721,CERN Long-term Monitoring Dataset of Plant Communities in Dongting Lake Beach (2011-2015),Large lake ecosystems,Temperate/Tropical,Freshwater,Plants,5,Xie Yonghong,NA,POINT (10486138 3298677)
722,"CERN Gansu Linze desert plant communities, 2005-2008â€” soil macrofauna",Deserts and xeric shrublands,Temperate,Terrestrial,Plants,4,NA,NA,POINT (8964471 4430722)
723,"CERN Gansu Linze desert plant communities, 2005-2008â€” station monitoring",Deserts and xeric shrublands,Temperate,Terrestrial,Plants,3,NA,NA,POINT (8961086 4426087)
724,CERN Gansu Linze desert plant communities 2005-2008â€” auxiliary monitoring,Deserts and xeric shrublands,Temperate,Terrestrial,Plants,3,NA,NA,POINT (8964385 4429073)
725,CERN A dynamic dataset of plant community composition in HulunBuir Stipa Baicalensis meadow steppe (2009â€“2015),"Temperate grasslands, savannas and shrublands",Temperate,Terrestrial,Plants,7,XIN Xiaoping,NA,POINT (10228942 5529711)
726,CERN Biomass data of Huitong Chinese fir forest Station from 1973 to 2007,Temperate broadleaf and mixed forests,Temperate,Terrestrial,Plants,7,NA,NA,POINT (10264389 3013957)
727,"CERN A plant community dataset of marsh ecosystem for Sanjiang Plain, China 2013 â€“ 2015",Flooded grasslands and savannas,Temperate,Freshwater,Plants,3,TAN Wenwen,ZHAO Zhichun,POINT (11483156 5337098)
728,"CERN A plant community dataset of marsh ecosystem for Sanjiang Plain, China 2000 â€“ 2012",Flooded grasslands and savannas,Temperate,Freshwater,Plants,13,TAN Wenwen,ZHAO Zhichun,POINT (11483156 5337098)
729,"CERN Observational data of plant community species composition of QinLing Station in Shanxi province, 2007-2008",Temperate broadleaf and mixed forests,Temperate,Terrestrial,Plants,2,NA,NA,POINT (9938529 3758709)
730,"CERN Zhejiang Tiantong soil macrofauna community, 2007-2009",Tropical and subtropical moist broadleaf forests,Temperate/Tropical,Terrestrial,Invertebrates,2,Fangfang Yao,Xihua Wang,POINT (11293739 3349555)
735,"CERN Guangdong Dinghu Mountain soil macrofauna community, 2004 to 2005",Temperate broadleaf and mixed forests,Temperate/Tropical,Terrestrial,Invertebrates,2,Qianmei Zhang,NA,POINT (10621924 2600857)
736,CERN Guangdong Dinghu Mountain plant community composition from 2003 to 2008 - herbs,Temperate broadleaf and mixed forests,Temperate/Tropical,Terrestrial,Plants,2,Qianmei Zhang,NA,POINT (10621924 2600857)
737,CERN Guangdong Dinghu Mountain plant community composition from 2003 to 2008 - shrub,Temperate broadleaf and mixed forests,Temperate/Tropical,Terrestrial,Plants,7,Qianmei Zhang,NA,POINT (10621924 2600857)
738,"CERN Guangdong Heshan soil macrofauna community, 1994-2005",Temperate broadleaf and mixed forests,Temperate/Tropical,Terrestrial,Invertebrates,12,Raoxing Quan,NA,POINT (10666844 2545637)
739,"CERN Inner Mongolia Xilingol plant assemblage monitoring, 2005-2008","Temperate grasslands, savannas and shrublands",Temperate,Terrestrial,Plants,4,"Xingguo Han, Yongfei Bai, Qingmin Pan, Nianpeng He",NA,POINT (10244714 4891807)
740,"CERN Ningxia Shapotou desert fauna community, 2003-2008",Deserts and xeric shrublands,Temperate,Terrestrial,Invertebrates,5,"Xinrong Li, Haiyan Zhou, Xinping Wang",NA,POINT (9478619 4211879)
741,"CERN Jiangsu Taihu Lake phytoplankton community composition, 1991-2008",Large lake ecosystems,Temperate/Tropical,Freshwater,Multiple,16,Guangwei Zhu,NA,POINT (11087643 3532584)
742,A dataset of species composition and biomass in successional stages of Tiantong typical evergreen broad-leaved forest (2008â€“2017),Temperate broadleaf and mixed forests,Temperate/Tropical,Terrestrial,Plants,10,Haibo Yang,NA,POINT (11294399 3348730)
743,"Assemblages of herbs in Heshan station in Guangdong Province China, 2005-2007",Temperate broadleaf and mixed forests,Tropical,Terrestrial,Plants,3,Xing-Quang Rao (饶兴权),NA,POINT (10666895 2545723)
744,"Assemblages of shrubs in Heshan station in Guangdong Province China, 2005-2007",Temperate broadleaf and mixed forests,Tropical,Terrestrial,Plants,3,Xing-Quang Rao,NA,POINT (10666895 2545723)
745,"Observational data of  bird community species composition of Sanjiang station in Heilongjiang Province China, 2001-2005",Small lake ecosystems,Temperate,Terrestrial,Birds,6,Sanjiang station in Heilongjiang Province China,NA,POINT (11484701 5336794)
746,"Observational data of  plant community species composition of Sanjiang station in Heilongjiang Province China, 2000-2006",Small lake ecosystems,Temperate,Terrestrial,Plants,7,Sanjiang station in Heilongjiang Province China,NA,POINT (11483087 5337365)
747,"Plant community monitoring data in the Inner Mongolia Hulun Buir research station, 2006-2008","Temperate grasslands, savannas and shrublands",Temperate,Terrestrial,Plants,3,Ruirui Yan (闫瑞瑞),NA,POINT (10210251 5537526)
748,TaiHu lake's zooplankton community composition data of 8 plots from the year 1997 to 2002,Large lake ecosystems,Temperate,Freshwater,Invertebrates,6,Shen Min,NA,POINT (11088371 3532895)
749,Observational data on shrub composition at Gongga Mountain in Sichuan Province of China in the year 1999 and 2005,Temperate broadleaf and mixed forests,Temperate,Terrestrial,Plants,7,Yang Yang (杨阳),NA,POINT (9465170 3323371)
750,Observational data on tree composition at Gongga Mountain in Sichuan Province of China in the year 1999 and 2005,Temperate broadleaf and mixed forests,Temperate,Terrestrial,Plants,7,Yang Yang (杨阳),NA,POINT (9465170 3323371)
751,"Plant compositions in the herbaceous layer of forest communities in Xishuangbanna, Sichuan Province of China from 1999 to 2006",Tropical and subtropical moist broadleaf forests,Tropical,Terrestrial,Plants,6,Yan Luo (罗艳),NA,POINT (9581720 2461735)
752,"Plant compositions in the shrub layer of forest communities in Xishuangbanna, Sichuan Province of China from 2001 to 2006",Tropical and subtropical moist broadleaf forests,Tropical,Terrestrial,Plants,6,Yan Luo (罗艳),NA,POINT (9581720 2461735)
753,"Plant compositions in the tree layer of forest communities in Xishuangbanna, Sichuan Province of China from 1998 to 2006",Tropical and subtropical moist broadleaf forests,Tropical,Terrestrial,Plants,9,Yan Luo (罗艳),NA,POINT (9581720 2461735)
754,Cottonwood Lake Study Area - Invertebrate Counts (ver. 2.0),"Temperate grasslands, savannas and shrublands",Temperate,Freshwater,Invertebrates,30,U.S. Geological Survey - ScienceBase,Northern Prairie Wildlife Research Center,POINT (-8547877 5283996)
755,Cottonwood Lake Study Area - Amphibians (ver. 2.0),"Temperate grasslands, savannas and shrublands",Temperate,Freshwater,Amphibians,29,David M Mushet,"Matthew J Solensky, npwrc_datamanager",POINT (-8547878 5283996)
756,Data from: Using beta diversity to inform agricultural policies and conservation actions on Mediterranean farmland,"Mediterranean forests, woodlands and scrubs",Temperate,Terrestrial,Birds,18,Joana Santana,NA,POINT (0 0)
761,"Amphibians and reptiles of TrÃªs Lagoas, Mato Grosso do Sul, Brazil","Tropical and subtropical grasslands, savannas and shrublands",Tropical,Terrestrial,Multiple,5,Luis Felipe Toledo,NA,POINT (-4900561 -2328307)
762,Anurans Pitfall Traps Southern Brazil,"Tropical and subtropical grasslands, savannas and shrublands",Tropical,Terrestrial,Amphibians,3,Tiago Gomes dos Santos,Sonia Zanini Cechin,POINT (-4993339 -3345240)
763,Slug Numbers â€“ Beckingham 1999 â€“ 2002 (series 1999-2001),Temperate broadleaf and mixed forests,Temperate,Terrestrial,Invertebrates,3,Chris du Feu,NA,POINT (-68907.86 5966019)
764,Slug Numbers â€“ Beckingham 1999 â€“ 2002 (series 2001-2002),Temperate broadleaf and mixed forests,Temperate,Terrestrial,Invertebrates,2,Chris du Feu,NA,POINT (-68907.86 5966019)
765,"Abundances of stream benthic macroinvertebrates during a 6-year monitoring period of a glacier-fed stream in South Tyrol, Italy",Small river ecosystems,Temperate,Freshwater,Invertebrates,6,Alberto Scotti,Roberta Bottarin,POINT (923192.7 5243456)
766,"Abundances of stream benthic macroinvertebrates and related environmental variables of a glacier-fed stream in South Tyrol, Italy (2016-2022)",Small river ecosystems,Temperate,Freshwater,Invertebrates,7,Alberto Scotti,Roberta Bottarin,POINT (923192.7 5243456)
768,Farmland bird monitoring data in North-east Germany 1999-2002 &amp; 2013-2015,Temperate broadleaf and mixed forests,Temperate,Terrestrial,Birds,17,Michael Glemnitz,NA,POINT (1137348 5960463)
769,BahÃ­a Blanca Estuary Puerto Cuatreros - Ciliates (1986-2006),Temperate shelf and seas ecoregions,Temperate,Marine,Multiple,21,Valeria Ana Guinder,M. Celeste Lopez-Abbate,POINT (-5601140 -4356449)
774,Trinidad's Northern Range Freshwater Diatom Survey (2011-2015),Small river ecosystems,Tropical,Freshwater,Plants,5,Amy E. Deacon,Anne E. Magurran,POINT (-5900895 1197115)
778,Trinidad's Northern Range Freshwater Fish Survey (2011-2015),Small river ecosystems,Tropical,Freshwater,Fish,5,Amy E. Deacon,Anne E. Magurran,POINT (-5900895 1197115)
779,Fish Communities - Forillon,Small river ecosystems,Temperate,Freshwater,Fish,10,Daniel Sigouin,NA,POINT (-5495486 5479814)
786,"Netherlands ground beetles, Insect Change study 1102",Temperate broadleaf and mixed forests,Temperate,Terrestrial,Invertebrates,61,Roel van Klink,NA,POINT (543087.1 5901686)
788,Wildlife of a garden: hoverflies,Temperate broadleaf and mixed forests,Temperate,Terrestrial,Invertebrates,30,Francis Gilbert,NA,POINT (-90056.27 5885068)
789,Ants assemblages in the Portal LTER,Deserts and xeric shrublands,Tropical,Terrestrial,Invertebrates,22,Roeal van Klink,Morgan Ernest,POINT (-10047382 3589923)
790,Ground beetles in the Dolomites,Multiple,Polar/Temperate,Terrestrial,Invertebrates,30,Roberto Pizzolotto,NA,POINT (1020517 5195559)
791,"Long-term (2005â€“2017) macromoth community monitoring at Mt. Jirisan National Park, South Korea",Temperate coniferous forest,Temperate,Terrestrial,Invertebrates,64,Sei-Woong Choi,NA,POINT (11610662 3972042)
793,"Monthly drift samples of invertebrates from the River Pawnmpawm, Ghana",Small river ecosystems,Tropical,Freshwater,Invertebrates,2,Rosina Kyerematen,NA,POINT (-20943.08 694512.9)
794,"Surber samples of invertebrates from the River Pawnmpawm, Ghana",Small river ecosystems,Tropical,Freshwater,Invertebrates,2,Rosina Kyerematen,NA,POINT (-20943.08 694512.9)
795,Trinidad's Northern Range Freshwater Invertebrate Survey (2011-2015),Small river ecosystems,Tropical,Freshwater,Invertebrates,5,Amy E. Deacon,Anne E. Magurran,POINT (-5900895 1197115)
799,Monthly data of mesozooplankton abundance and biomass for a shelf station off A CoruÃ±a (NW Spain): 1990-2018 (Series 1990-1996),Temperate shelf and seas ecoregions,Temperate,Marine,Invertebrates,7,Antonio Bode,NA,POINT (-741920.5 4877513)
800,Monthly data of mesozooplankton abundance and biomass for a shelf station off A CoruÃ±a (NW Spain): 1990-2018 (Series 1997-2018),Temperate shelf and seas ecoregions,Temperate,Marine,Invertebrates,22,Antonio Bode,NA,POINT (-741920.5 4877513)
801,BahÃ­a Blanca Estuary Puerto Cuatreros - Microzooplankton (2008-2010),Temperate shelf and seas ecoregions,Temperate,Marine,Multiple,3,Valeria Ana Guinder,M. Celeste Lopez-Abbate,POINT (-5587605 -4365058)
802,Latvia LTER Scots pine forest oribatid mite communities 1998-2006,Temperate coniferous forest,Temperate,Terrestrial,Invertebrates,9,Tancredi Caruso,NA,POINT (2013191 6435946)
803,Monthly series of phytoplankton abundance collected between 1989 and 2016 at A CoruÃ±a (NW Spain) (Series 1989-2008),Temperate shelf and seas ecoregions,Temperate,Marine,Plants,20,Antonio Bode,NA,POINT (-741920.5 4877513)
804,Monthly series of phytoplankton abundance collected between 1989 and 2016 at A CoruÃ±a (NW Spain) (Series 2009-2016),Temperate shelf and seas ecoregions,Temperate,Marine,Plants,8,Antonio Bode,NA,POINT (-741920.5 4877513)
805,BahÃ­a Blanca Estuary Puerto Cuatreros - Phytoplankton (2008-2010),Temperate shelf and seas ecoregions,Temperate,Marine,Multiple,3,Valeria Ana Guinder,M. Celeste Lopez-Abbate,POINT (-5587605 -4365058)
806,"BahÃ­a Blanca Estuary Puerto Cuatreros - Phytoplankton (2006-2008,2012)",Temperate shelf and seas ecoregions,Temperate,Marine,Multiple,7,Valeria Ana Guinder,M. Celeste Lopez-Abbate,POINT (-5601141 -4356448)
